### ISSUE TITLE
Unittest goes in infinite loop

### ISSUE THREAD

**Issue by vuliad** [amphp/redis#36]
Sorry for may be dump question, but I'm stuck while running phpunit test:
```php
class RedisTest extends \PHPUnit_Framework_TestCase
{
    /**
     * @test
     */
    public function redis()
    {
        \Amp\reactor(\Amp\driver())->run(function () {
            $redis = new \Amp\Redis\Client("tcp://localhost:6379");
            $result = yield $redis->set("test", "123123123");
        });

```
It done redis set, but then goes in infinite loop:
```
^C[Current opline: in internal function uv_run]
>00096:             \uv_run($this->loop, $this->immediates ? \UV::RUN_NOWAIT : \UV::RUN_ONCE);
 00097:         }
 00098:
```
at the same time - if i run something like 
```
    public function redis()
    {
        \Amp\reactor(\Amp\driver())->run(function () {
               yield new \Amp\Pause(500);
        });
```
Test successfully ends.
I tried additionaly add \Amp\stop(), but it stuck at yield $redis line..
Where i'm wrong?

**Comment by kelunik** [comment]
Does the same happen without `php-uv`?

**Comment by vuliad** [comment]
Same here:
```bash
^C^C[Current opline: in internal function stream_select]
>00241:         if (!@stream_select($r, $w, $e, $sec, $usec)) {
 00242:             return;
 00243:         }
p
```
I tried with php-cli phpdbg, diffrent amp versions.Thought I'm missing something.

**Comment by vuliad** [comment]
My previous report a bit incorrect: this problem appears from time to time, but it frequency increases if i send long data to redis:
```
$result = yield $redis->set("test", str_repeat('aaa',6000000));
```

**Comment by bwoebi** [comment]
I think the I/O traffic could help here. Is connection aborted? Redis doesn't reply? Or what exactly?

So, may you please provide the stream data (including packet boundaries)?

**Comment by vuliad** [comment]
No there is no connection between "long data", previouse report almost correct, but \Amp\stop() - realy help to go out of loop.
There is a problem with keepAliveCount: it loops, because keepAliveCount=1. 
I trying to debug this by setting "hooks": before is enter in function, after is - out
and here is my "trace":
```
__construct, keepAliveCount:0
run, keepAliveCount:0
	run-onStart, keepAliveCount:0

		before immediately, keepAliveCount:0
		after immediately, keepAliveCount:1
		
		before tryImmediate, keepAliveCount:1
			before watchStream options[enable]=true, keepAliveCount:0
			after watchStream options[enable]=true, keepAliveCount:1
		
			before registerTimer, keepAliveCount:1
			after registerTimer, keepAliveCount:2
		after tryImmediate, keepAliveCount:2
		
	run-onStart-out, keepAliveCount:2

	before cancel:2
		before clearWatcher, keepAliveCount:2
		after clearWatcher, keepAliveCount:1
	after cancel:1

	before cancel:1
		before clearWatcher, keepAliveCount:1
		after clearWatcher, keepAliveCount:0
	after cancel:0

	before watchStream options[enable]=true, keepAliveCount:0
	after watchStream options[enable]=true, keepAliveCount:1

	before watchStream options[enable]=false, keepAliveCount:1
	after watchStream options[enable]=false, keepAliveCount:1

	before enable, keepAliveCount:1
	after enable, keepAliveCount:2

	before disable, keepAliveCount:2
	after disable, keepAliveCount:1
```
Got any ideas?

**Comment by vuliad** [comment]
And traffic data
```
tcpdump: verbose output suppressed, use -v or -vv for full protocol decode
listening on lo, link-type EN10MB (Ethernet), capture size 65535 bytes


21:51:38.614495 IP localhost.64303 > localhost.6379: Flags [S], seq 2765002245,                                                                                                              win 43690, options [mss 65495,sackOK,TS val 8217646 ecr 0,nop,wscale 9], length                                                                                                              0
E..<.+@.@.J........../...............0.........
.}d........
21:51:38.614502 IP localhost.6379 > localhost.64303: Flags [S.], seq 4241938591,                                                                                                              ack 2765002246, win 43690, options [mss 65495,sackOK,TS val 8217646 ecr 8217646                                                                                                             ,nop,wscale 9], length 0
E..<..@.@.<............/.............0.........
.}d..}d....
21:51:38.614508 IP localhost.64303 > localhost.6379: Flags [.], ack 1, win 86, o                                                                                                             ptions [nop,nop,TS val 8217646 ecr 8217646], length 0
E..4.,@.@.J........../.............V.(.....
.}d..}d.
21:51:38.618825 IP localhost.64303 > localhost.6379: Flags [P.], seq 1:132, ack                                                                                                              1, win 86, options [nop,nop,TS val 8217647 ecr 8217646], length 131
E....-@.@.J........../.............V.......
.}d/.}d.*3
$3
set
$4
test
$100
aaaaaaaaaaaaaaaaaaaaaaaaaaaaaaaaaaaaaaaaaaaaaaaaaaaaaaaaaaaaaaaaaaaaaaaaaaaaaaaa                                                                                                             aaaaaaaaaaaaaaaaaaaa

21:51:38.618836 IP localhost.6379 > localhost.64303: Flags [.], ack 132, win 88,                                                                                                              options [nop,nop,TS val 8217647 ecr 8217647], length 0
E..4..@.@..3.........../...........X.(.....
.}d/.}d/
21:51:38.618863 IP localhost.6379 > localhost.64303: Flags [P.], seq 1:6, ack 13                                                                                                             2, win 88, options [nop,nop,TS val 8217647 ecr 8217647], length 5
E..9..@.@..-.........../...........X.-.....
.}d/.}d/+OK

21:51:38.618865 IP localhost.64303 > localhost.6379: Flags [.], ack 6, win 86, o                                                                                                             ptions [nop,nop,TS val 8217647 ecr 8217647], length 0
E..4..@.@.J........../.............V.(.....
.}d/.}d/

```
redis version 3.0.7 (buy i also tried with 2.X version)

**Comment by bwoebi** [comment]
I think hex data is more helpful than many dots ;-) sorry for not being clear.

**Comment by vuliad** [comment]
Here it is
```
22:07:20.773297 IP localhost.64308 > localhost.6379: Flags [S], seq 224170970, win 43690, options [mss 65495,sackOK,TS val 8453185 ecr 0,nop,wscale 9], length 0
	0x0000:  0000 0000 0000 0000 0000 0000 0800 4500
	0x0010:  003c 6f9b 4000 4006 cd1e 7f00 0001 7f00
	0x0020:  0001 fb34 18eb 0d5c 93da 0000 0000 a002
	0x0030:  aaaa fe30 0000 0204 ffd7 0402 080a 0080
	0x0040:  fc41 0000 0000 0103 0309
22:07:20.773309 IP localhost.6379 > localhost.64308: Flags [S.], seq 574822707, ack 224170971, win 43690, options [mss 65495,sackOK,TS val 8453185 ecr 8453185,nop,wscale 9], length 0
	0x0000:  0000 0000 0000 0000 0000 0000 0800 4500
	0x0010:  003c 0000 4000 4006 3cba 7f00 0001 7f00
	0x0020:  0001 18eb fb34 2243 1933 0d5c 93db a012
	0x0030:  aaaa fe30 0000 0204 ffd7 0402 080a 0080
	0x0040:  fc41 0080 fc41 0103 0309
22:07:20.773318 IP localhost.64308 > localhost.6379: Flags [.], ack 1, win 86, options [nop,nop,TS val 8453185 ecr 8453185], length 0
	0x0000:  0000 0000 0000 0000 0000 0000 0800 4500
	0x0010:  0034 6f9c 4000 4006 cd25 7f00 0001 7f00
	0x0020:  0001 fb34 18eb 0d5c 93db 2243 1934 8010
	0x0030:  0056 fe28 0000 0101 080a 0080 fc41 0080
	0x0040:  fc41
22:07:20.806544 IP localhost.64308 > localhost.6379: Flags [P.], seq 1:132, ack 1, win 86, options [nop,nop,TS val 8453194 ecr 8453185], length 131
	0x0000:  0000 0000 0000 0000 0000 0000 0800 4500
	0x0010:  00b7 6f9d 4000 4006 cca1 7f00 0001 7f00
	0x0020:  0001 fb34 18eb 0d5c 93db 2243 1934 8018
	0x0030:  0056 feab 0000 0101 080a 0080 fc4a 0080
	0x0040:  fc41 2a33 0d0a 2433 0d0a 7365 740d 0a24
	0x0050:  340d 0a74 6573 740d 0a24 3130 300d 0a61
	0x0060:  6161 6161 6161 6161 6161 6161 6161 6161
	0x0070:  6161 6161 6161 6161 6161 6161 6161 6161
	0x0080:  6161 6161 6161 6161 6161 6161 6161 6161
	0x0090:  6161 6161 6161 6161 6161 6161 6161 6161
	0x00a0:  6161 6161 6161 6161 6161 6161 6161 6161
	0x00b0:  6161 6161 6161 6161 6161 6161 6161 6161
	0x00c0:  6161 610d 0a
22:07:20.806576 IP localhost.6379 > localhost.64308: Flags [.], ack 132, win 88, options [nop,nop,TS val 8453194 ecr 8453194], length 0
	0x0000:  0000 0000 0000 0000 0000 0000 0800 4500
	0x0010:  0034 e575 4000 4006 574c 7f00 0001 7f00
	0x0020:  0001 18eb fb34 2243 1934 0d5c 945e 8010
	0x0030:  0058 fe28 0000 0101 080a 0080 fc4a 0080
	0x0040:  fc4a
22:07:20.806613 IP localhost.6379 > localhost.64308: Flags [P.], seq 1:6, ack 132, win 88, options [nop,nop,TS val 8453194 ecr 8453194], length 5
	0x0000:  0000 0000 0000 0000 0000 0000 0800 4500
	0x0010:  0039 e576 4000 4006 5746 7f00 0001 7f00
	0x0020:  0001 18eb fb34 2243 1934 0d5c 945e 8018
	0x0030:  0058 fe2d 0000 0101 080a 0080 fc4a 0080
	0x0040:  fc4a 2b4f 4b0d 0a
22:07:20.806615 IP localhost.64308 > localhost.6379: Flags [.], ack 6, win 86, options [nop,nop,TS val 8453194 ecr 8453194], length 0
	0x0000:  0000 0000 0000 0000 0000 0000 0800 4500
	0x0010:  0034 6f9e 4000 4006 cd23 7f00 0001 7f00
	0x0020:  0001 fb34 18eb 0d5c 945e 2243 1939 8010
	0x0030:  0056 fe28 0000 0101 080a 0080 fc4a 0080
	0x0040:  fc4a
```

**Comment by kelunik** [comment]
@vuliad So it's everything fine with `Amp\stop`?

Connections keep the event loop running currently. I could disable that for `Client`, but leave it enabled for `SubscribeClient`.

**Comment by vuliad** [comment]
Ok. I don't understand yet - what problem i had with big payloads, i will continue test it and create new issue if problem appear again.
For this issue - i just had to add
```
$redis->close();
```
to resolve my problem. Can't understand how i miss this.(
Thanks for helping.

**Comment by kelunik** [comment]
There was an issue with large payloads (you even opened it): #31. Maybe you used an old version accidentally?

As said, as long as the connection is connected, the event loop will keep running.
